<?xml version="1.0" encoding="UTF-8"?>
<databaseMetaData xmlns:xsi="http://www.w3.org/2001/XMLSchema-instance" xsi:noNamespaceSchemaLocation="../xsd/DatabaseProperties.xsd">
	<database name="development" type="MYSQL">
		<driverclassname value="com.mysql.jdbc.Driver"/>
		<url value="jdbc:mysql://localhost:3306/common"/>
		<username value="modnaut00"/>
		<password value="zp4X263tTSv06On"/>
		<maxactive value="15"/>
		<maxidle value="3"/>
	</database>	
</databaseMetaData>